{
  "$comment": "This JSON Schema enforces portable structure and expressible local invariants. SignLab Pydantic and application validation remains authoritative for canonical digests, timestamp ordering, DAG closure, cross-record bindings, event-log completeness, cross-field locator equality, and withdrawal closure.",
  "$defs": {
    "TaxonomyRef": {
      "additionalProperties": false,
      "description": "Portable identity embedded in downstream manifests and bundles.",
      "properties": {
        "id": {
          "pattern": "^[a-z][a-z0-9_-]*$",
          "title": "Id",
          "type": "string"
        },
        "schema_version": {
          "const": "taxonomy-reference/1",
          "title": "Schema Version",
          "type": "string"
        },
        "sha256": {
          "pattern": "^sha256:[0-9a-f]{64}$",
          "title": "Sha256",
          "type": "string"
        },
        "version": {
          "pattern": "^(0|[1-9][0-9]*)\\.(0|[1-9][0-9]*)\\.(0|[1-9][0-9]*)$",
          "title": "Version",
          "type": "string"
        }
      },
      "required": [
        "schema_version",
        "id",
        "version",
        "sha256"
      ],
      "title": "TaxonomyRef",
      "type": "object"
    }
  },
  "$id": "https://signlab.dev/schemas/collection-readiness-1.schema.json",
  "$schema": "https://json-schema.org/draft/2020-12/schema",
  "additionalProperties": false,
  "allOf": [
    {
      "else": {
        "properties": {
          "blockers": {
            "contains": {
              "const": "access_controls"
            },
            "uniqueItems": true
          }
        }
      },
      "if": {
        "properties": {
          "access_controls_ready": {
            "const": true
          }
        },
        "required": [
          "access_controls_ready"
        ]
      },
      "then": {
        "properties": {
          "blockers": {
            "not": {
              "contains": {
                "const": "access_controls"
              }
            },
            "uniqueItems": true
          }
        }
      }
    },
    {
      "else": {
        "properties": {
          "blockers": {
            "contains": {
              "const": "adult_jurisdictions"
            },
            "uniqueItems": true
          }
        }
      },
      "if": {
        "properties": {
          "adult_jurisdictions_ready": {
            "const": true
          }
        },
        "required": [
          "adult_jurisdictions_ready"
        ]
      },
      "then": {
        "properties": {
          "blockers": {
            "not": {
              "contains": {
                "const": "adult_jurisdictions"
              }
            },
            "uniqueItems": true
          }
        }
      }
    },
    {
      "else": {
        "properties": {
          "blockers": {
            "contains": {
              "const": "affiliation_sponsorship"
            },
            "uniqueItems": true
          }
        }
      },
      "if": {
        "properties": {
          "affiliation_sponsorship_ready": {
            "const": true
          }
        },
        "required": [
          "affiliation_sponsorship_ready"
        ]
      },
      "then": {
        "properties": {
          "blockers": {
            "not": {
              "contains": {
                "const": "affiliation_sponsorship"
              }
            },
            "uniqueItems": true
          }
        }
      }
    },
    {
      "else": {
        "properties": {
          "blockers": {
            "contains": {
              "const": "backup_deletion"
            },
            "uniqueItems": true
          }
        }
      },
      "if": {
        "properties": {
          "backup_deletion_ready": {
            "const": true
          }
        },
        "required": [
          "backup_deletion_ready"
        ]
      },
      "then": {
        "properties": {
          "blockers": {
            "not": {
              "contains": {
                "const": "backup_deletion"
              }
            },
            "uniqueItems": true
          }
        }
      }
    },
    {
      "else": {
        "properties": {
          "blockers": {
            "contains": {
              "const": "consent_documents"
            },
            "uniqueItems": true
          }
        }
      },
      "if": {
        "properties": {
          "consent_documents_ready": {
            "const": true
          }
        },
        "required": [
          "consent_documents_ready"
        ]
      },
      "then": {
        "properties": {
          "blockers": {
            "not": {
              "contains": {
                "const": "consent_documents"
              }
            },
            "uniqueItems": true
          }
        }
      }
    },
    {
      "else": {
        "properties": {
          "blockers": {
            "contains": {
              "const": "encrypted_storage"
            },
            "uniqueItems": true
          }
        }
      },
      "if": {
        "properties": {
          "encrypted_storage_ready": {
            "const": true
          }
        },
        "required": [
          "encrypted_storage_ready"
        ]
      },
      "then": {
        "properties": {
          "blockers": {
            "not": {
              "contains": {
                "const": "encrypted_storage"
              }
            },
            "uniqueItems": true
          }
        }
      }
    },
    {
      "else": {
        "properties": {
          "blockers": {
            "contains": {
              "const": "ethics_legal_institutional"
            },
            "uniqueItems": true
          }
        }
      },
      "if": {
        "properties": {
          "ethics_legal_institutional_ready": {
            "const": true
          }
        },
        "required": [
          "ethics_legal_institutional_ready"
        ]
      },
      "then": {
        "properties": {
          "blockers": {
            "not": {
              "contains": {
                "const": "ethics_legal_institutional"
              }
            },
            "uniqueItems": true
          }
        }
      }
    },
    {
      "else": {
        "properties": {
          "blockers": {
            "contains": {
              "const": "identity_vault_operations"
            },
            "uniqueItems": true
          }
        }
      },
      "if": {
        "properties": {
          "identity_vault_operations_ready": {
            "const": true
          }
        },
        "required": [
          "identity_vault_operations_ready"
        ]
      },
      "then": {
        "properties": {
          "blockers": {
            "not": {
              "contains": {
                "const": "identity_vault_operations"
              }
            },
            "uniqueItems": true
          }
        }
      }
    },
    {
      "else": {
        "properties": {
          "blockers": {
            "contains": {
              "const": "legacy_media_quarantine"
            },
            "uniqueItems": true
          }
        }
      },
      "if": {
        "properties": {
          "legacy_media_quarantined": {
            "const": true
          }
        },
        "required": [
          "legacy_media_quarantined"
        ]
      },
      "then": {
        "properties": {
          "blockers": {
            "not": {
              "contains": {
                "const": "legacy_media_quarantine"
              }
            },
            "uniqueItems": true
          }
        }
      }
    },
    {
      "else": {
        "properties": {
          "blockers": {
            "contains": {
              "const": "lineage_tracking"
            },
            "uniqueItems": true
          }
        }
      },
      "if": {
        "properties": {
          "lineage_tracking_ready": {
            "const": true
          }
        },
        "required": [
          "lineage_tracking_ready"
        ]
      },
      "then": {
        "properties": {
          "blockers": {
            "not": {
              "contains": {
                "const": "lineage_tracking"
              }
            },
            "uniqueItems": true
          }
        }
      }
    },
    {
      "else": {
        "properties": {
          "blockers": {
            "contains": {
              "const": "participant_contact_process"
            },
            "uniqueItems": true
          }
        }
      },
      "if": {
        "properties": {
          "participant_contact_process_ready": {
            "const": true
          }
        },
        "required": [
          "participant_contact_process_ready"
        ]
      },
      "then": {
        "properties": {
          "blockers": {
            "not": {
              "contains": {
                "const": "participant_contact_process"
              }
            },
            "uniqueItems": true
          }
        }
      }
    },
    {
      "else": {
        "properties": {
          "blockers": {
            "contains": {
              "const": "pseudonymous_ids"
            },
            "uniqueItems": true
          }
        }
      },
      "if": {
        "properties": {
          "pseudonymous_ids_ready": {
            "const": true
          }
        },
        "required": [
          "pseudonymous_ids_ready"
        ]
      },
      "then": {
        "properties": {
          "blockers": {
            "not": {
              "contains": {
                "const": "pseudonymous_ids"
              }
            },
            "uniqueItems": true
          }
        }
      }
    },
    {
      "else": {
        "properties": {
          "blockers": {
            "contains": {
              "const": "retention_publication_scope"
            },
            "uniqueItems": true
          }
        }
      },
      "if": {
        "properties": {
          "retention_publication_scope_ready": {
            "const": true
          }
        },
        "required": [
          "retention_publication_scope_ready"
        ]
      },
      "then": {
        "properties": {
          "blockers": {
            "not": {
              "contains": {
                "const": "retention_publication_scope"
              }
            },
            "uniqueItems": true
          }
        }
      }
    },
    {
      "else": {
        "properties": {
          "blockers": {
            "contains": {
              "const": "withdrawal_dry_run"
            },
            "uniqueItems": true
          }
        }
      },
      "if": {
        "properties": {
          "withdrawal_dry_run_ready": {
            "const": true
          }
        },
        "required": [
          "withdrawal_dry_run_ready"
        ]
      },
      "then": {
        "properties": {
          "blockers": {
            "not": {
              "contains": {
                "const": "withdrawal_dry_run"
              }
            },
            "uniqueItems": true
          }
        }
      }
    }
  ],
  "description": "Fail-closed collection gate that may truthfully remain blocked.",
  "properties": {
    "access_controls_ready": {
      "title": "Access Controls Ready",
      "type": "boolean"
    },
    "adult_jurisdictions_ready": {
      "title": "Adult Jurisdictions Ready",
      "type": "boolean"
    },
    "affiliation_sponsorship_ready": {
      "title": "Affiliation Sponsorship Ready",
      "type": "boolean"
    },
    "assessed_at": {
      "pattern": "^[0-9]{4}-[0-9]{2}-[0-9]{2}T[0-9]{2}:[0-9]{2}:[0-9]{2}Z$",
      "title": "Assessed At",
      "type": "string"
    },
    "backup_deletion_ready": {
      "title": "Backup Deletion Ready",
      "type": "boolean"
    },
    "blockers": {
      "items": {
        "enum": [
          "access_controls",
          "adult_jurisdictions",
          "affiliation_sponsorship",
          "backup_deletion",
          "consent_documents",
          "encrypted_storage",
          "ethics_legal_institutional",
          "identity_vault_operations",
          "legacy_media_quarantine",
          "lineage_tracking",
          "participant_contact_process",
          "pseudonymous_ids",
          "retention_publication_scope",
          "withdrawal_dry_run"
        ],
        "type": "string"
      },
      "minItems": 1,
      "title": "Blockers",
      "type": "array",
      "uniqueItems": true
    },
    "consent_documents_ready": {
      "title": "Consent Documents Ready",
      "type": "boolean"
    },
    "encrypted_storage_ready": {
      "title": "Encrypted Storage Ready",
      "type": "boolean"
    },
    "ethics_legal_institutional_ready": {
      "title": "Ethics Legal Institutional Ready",
      "type": "boolean"
    },
    "identity_vault_operations_ready": {
      "title": "Identity Vault Operations Ready",
      "type": "boolean"
    },
    "legacy_media_quarantined": {
      "title": "Legacy Media Quarantined",
      "type": "boolean"
    },
    "lineage_tracking_ready": {
      "title": "Lineage Tracking Ready",
      "type": "boolean"
    },
    "participant_contact_process_ready": {
      "title": "Participant Contact Process Ready",
      "type": "boolean"
    },
    "policy_id": {
      "pattern": "^policy_[0-9a-f]{32}$",
      "title": "Policy Id",
      "type": "string"
    },
    "pseudonymous_ids_ready": {
      "title": "Pseudonymous Ids Ready",
      "type": "boolean"
    },
    "readiness_id": {
      "pattern": "^readiness_[0-9a-f]{32}$",
      "title": "Readiness Id",
      "type": "string"
    },
    "retention_publication_scope_ready": {
      "title": "Retention Publication Scope Ready",
      "type": "boolean"
    },
    "schema_version": {
      "const": "collection-readiness/1",
      "title": "Schema Version",
      "type": "string"
    },
    "status": {
      "const": "blocked",
      "title": "Status",
      "type": "string"
    },
    "taxonomy": {
      "$ref": "#/$defs/TaxonomyRef"
    },
    "withdrawal_dry_run_ready": {
      "title": "Withdrawal Dry Run Ready",
      "type": "boolean"
    }
  },
  "required": [
    "schema_version",
    "readiness_id",
    "policy_id",
    "taxonomy",
    "assessed_at",
    "status",
    "consent_documents_ready",
    "pseudonymous_ids_ready",
    "encrypted_storage_ready",
    "access_controls_ready",
    "adult_jurisdictions_ready",
    "affiliation_sponsorship_ready",
    "backup_deletion_ready",
    "ethics_legal_institutional_ready",
    "identity_vault_operations_ready",
    "withdrawal_dry_run_ready",
    "lineage_tracking_ready",
    "legacy_media_quarantined",
    "participant_contact_process_ready",
    "retention_publication_scope_ready",
    "blockers"
  ],
  "title": "CollectionReadinessV1",
  "type": "object"
}
